{
  "protocol_version": "0.1",
  "schema": "localize-anything-generation-strategy-v1",
  "run_id": "example-run-001",
  "source_locale": "en-US",
  "target_locale": "zh-CN",
  "operating_mode": "greenfield_localization",
  "reference_policy": "style_only",
  "status": "review_required",
  "generation_readiness": "review_required",
  "route": {
    "mode": "high_assurance_handoff",
    "assurance": "partial",
    "reason_codes": ["localization_brief_confirmation_required", "unreviewed_high_risk_terms"]
  },
  "scope": {
    "batch_count": 1,
    "segment_count": 3
  },
  "gates": {
    "localization_brief": {
      "status": "draft",
      "required_human_confirmation_count": 1,
      "required_human_confirmations": ["target_audience"],
      "artifact": "localization-brief.json"
    },
    "terminology": {
      "status": "review_required",
      "terminology_assurance": "incomplete_review_required",
      "review_required_count": 2,
      "high_risk_unreviewed_count": 1,
      "conflict_count": 0,
      "artifact": "termbase-preflight-report.json"
    }
  },
  "work_packet_policy": {
    "allow_generation": true,
    "include_hard_constraints": true,
    "include_terminology_review": true,
    "include_generation_strategy": true,
    "blocked_reason_codes": [],
    "warning_codes": ["unreviewed_high_risk_terms", "localization_brief_confirmation_required"]
  },
  "draft_request_policy": {
    "provider_agnostic": true,
    "provider_call_performed": false,
    "quality_claim": "no_full_assurance_until_reviews_complete"
  },
  "blockers": [],
  "warnings": [
    {
      "code": "unreviewed_high_risk_terms",
      "message": "High-risk terminology still needs review before full terminology assurance.",
      "count": 1,
      "artifact": "termbase-preflight-report.json"
    }
  ],
  "artifacts": {
    "generation_strategy": "generation-strategy.json",
    "localization_brief": "localization-brief.json",
    "termbase_preflight_report": "termbase-preflight-report.json"
  },
  "limitations": [
    "strategy is deterministic and does not perform translation",
    "review_required still permits handoff generation but cannot claim full review or terminology assurance"
  ]
}
